{
  "$schema": "./schemas/protocol-registry.schema.json",
  "registryVersion": 1,
  "status": "draft_architecture_baseline",
  "protocol": {
    "name": "ccpocket.conversation",
    "major": 3,
    "minor": 0
  },
  "normativeDocuments": [
    "01-domain-and-receive.md",
    "02-wire-and-operations.md",
    "03-feature-module-contract.md",
    "04-migration-and-acceptance.md",
    "05-protocol-registry.md"
  ],
  "messages": [
    {
      "type": "core.hello",
      "featureId": "ccpocket.core",
      "featureMajor": 1,
      "featureMinor": 0,
      "direction": "client_to_server",
      "kind": "handshake",
      "targetScope": "connection",
      "delivery": "handshake",
      "requiredPayload": ["deviceId", "clientInstanceId", "clientBuild", "supportedProtocolRanges", "supportedFeatures"],
      "responseTypes": ["core.welcome", "core.error"]
    },
    {
      "type": "core.welcome",
      "featureId": "ccpocket.core",
      "featureMajor": 1,
      "featureMinor": 0,
      "direction": "server_to_client",
      "kind": "handshake",
      "targetScope": "connection",
      "delivery": "handshake",
      "requiredPayload": ["selectedProtocol", "bridgeInstanceId", "authenticatedSources", "features", "topology", "trustLevel", "connectionGeneration", "limits"],
      "responseTypes": []
    },
    {
      "type": "core.capabilities.get",
      "featureId": "ccpocket.core",
      "featureMajor": 1,
      "featureMinor": 0,
      "direction": "client_to_server",
      "kind": "request",
      "targetScope": "connection",
      "delivery": "bounded_read",
      "requiredPayload": [],
      "responseTypes": ["core.capabilities.snapshot", "core.error"]
    },
    {
      "type": "core.capabilities.snapshot",
      "featureId": "ccpocket.core",
      "featureMajor": 1,
      "featureMinor": 0,
      "direction": "server_to_client",
      "kind": "response",
      "targetScope": "connection",
      "delivery": "bounded_read",
      "requiredPayload": ["authenticatedSources", "features", "topology", "limits"]
    },
    {
      "type": "core.capabilities_changed",
      "featureId": "ccpocket.core",
      "featureMajor": 1,
      "featureMinor": 0,
      "direction": "server_to_client",
      "kind": "event",
      "targetScope": "source",
      "delivery": "memory_only",
      "requiredPayload": ["featureIds"]
    },
    {
      "type": "core.error",
      "featureId": "ccpocket.core",
      "featureMajor": 1,
      "featureMinor": 0,
      "direction": "server_to_client",
      "kind": "response",
      "targetScope": "connection",
      "delivery": "memory_only",
      "requiredPayload": ["code", "retryClass"]
    },

    {
      "type": "catalog.subscribe",
      "featureId": "ccpocket.conversation.sync",
      "featureMajor": 1,
      "featureMinor": 0,
      "direction": "client_to_server",
      "kind": "request",
      "targetScope": "source",
      "delivery": "subscription",
      "requiredPayload": ["filters", "knownRevision"],
      "responseTypes": ["sync.begin", "sync.complete", "core.error"]
    },
    {
      "type": "timeline.subscribe",
      "featureId": "ccpocket.conversation.sync",
      "featureMajor": 1,
      "featureMinor": 0,
      "direction": "client_to_server",
      "kind": "request",
      "targetScope": "thread",
      "delivery": "subscription",
      "requiredPayload": ["thread", "window", "knownRevision", "focus"],
      "responseTypes": ["sync.begin", "sync.complete", "core.error"]
    },
    {
      "type": "timeline.focus",
      "featureId": "ccpocket.conversation.sync",
      "featureMajor": 1,
      "featureMinor": 0,
      "direction": "client_to_server",
      "kind": "request",
      "targetScope": "turn",
      "delivery": "memory_only",
      "requiredPayload": ["focusGeneration"],
      "responseTypes": ["timeline.focused", "core.error"]
    },
    {
      "type": "timeline.focused",
      "featureId": "ccpocket.conversation.sync",
      "featureMajor": 1,
      "featureMinor": 0,
      "direction": "server_to_client",
      "kind": "response",
      "targetScope": "turn",
      "delivery": "memory_only",
      "requiredPayload": ["focusGeneration"]
    },
    {
      "type": "timeline.priority_watch.set",
      "featureId": "ccpocket.conversation.sync",
      "featureMajor": 1,
      "featureMinor": 0,
      "direction": "client_to_server",
      "kind": "request",
      "targetScope": "source",
      "delivery": "memory_only",
      "requiredPayload": ["threads", "watchGeneration", "reason"],
      "responseTypes": ["timeline.priority_watch.state", "core.error"]
    },
    {
      "type": "timeline.priority_watch.state",
      "featureId": "ccpocket.conversation.sync",
      "featureMajor": 1,
      "featureMinor": 0,
      "direction": "server_to_client",
      "kind": "response",
      "targetScope": "source",
      "delivery": "memory_only",
      "requiredPayload": ["acceptedThreads", "rejectedThreads", "watchGeneration", "maxTargets"]
    },
    {
      "type": "timeline.page.read",
      "featureId": "ccpocket.conversation.sync",
      "featureMajor": 1,
      "featureMinor": 0,
      "direction": "client_to_server",
      "kind": "request",
      "targetScope": "thread",
      "delivery": "bounded_read",
      "requiredPayload": ["thread", "locator", "direction", "limit", "knownRevision"],
      "responseTypes": ["timeline.turn_batch", "timeline.gap", "sync.complete", "core.error"]
    },
    {
      "type": "timeline.repair.request",
      "featureId": "ccpocket.conversation.sync",
      "featureMajor": 1,
      "featureMinor": 0,
      "direction": "client_to_server",
      "kind": "request",
      "targetScope": "thread",
      "delivery": "bounded_read",
      "requiredPayload": ["thread", "gapIds", "knownRevision"],
      "responseTypes": ["timeline.turn_batch", "timeline.gap", "sync.complete", "core.error"]
    },
    {
      "type": "sync.unsubscribe",
      "featureId": "ccpocket.conversation.sync",
      "featureMajor": 1,
      "featureMinor": 0,
      "direction": "client_to_server",
      "kind": "request",
      "targetScope": "sync_scope",
      "delivery": "memory_only",
      "requiredPayload": ["subscriptionId", "subscriptionKind"],
      "responseTypes": ["sync.unsubscribed", "core.error"]
    },
    {
      "type": "sync.unsubscribed",
      "featureId": "ccpocket.conversation.sync",
      "featureMajor": 1,
      "featureMinor": 0,
      "direction": "server_to_client",
      "kind": "response",
      "targetScope": "sync_scope",
      "delivery": "memory_only",
      "requiredPayload": ["subscriptionId", "subscriptionKind"]
    },
    {
      "type": "sync.begin",
      "featureId": "ccpocket.conversation.sync",
      "featureMajor": 1,
      "featureMinor": 0,
      "direction": "server_to_client",
      "kind": "event",
      "targetScope": "sync_scope",
      "delivery": "durable_projection",
      "requiredPayload": ["batchId", "sequence", "sourceRevision", "contentRevision", "scope"]
    },
    {
      "type": "catalog.snapshot",
      "featureId": "ccpocket.conversation.sync",
      "featureMajor": 1,
      "featureMinor": 0,
      "direction": "server_to_client",
      "kind": "event",
      "targetScope": "source",
      "delivery": "durable_projection",
      "requiredPayload": ["meta", "catalogRevision", "entries", "completeness"]
    },
    {
      "type": "catalog.patch",
      "featureId": "ccpocket.conversation.sync",
      "featureMajor": 1,
      "featureMinor": 0,
      "direction": "server_to_client",
      "kind": "event",
      "targetScope": "source",
      "delivery": "durable_projection",
      "requiredPayload": ["meta", "baseRevision", "upserts", "deletes", "coverage"]
    },
    {
      "type": "timeline.turn_batch",
      "featureId": "ccpocket.conversation.sync",
      "featureMajor": 1,
      "featureMinor": 0,
      "direction": "server_to_client",
      "kind": "event",
      "targetScope": "thread",
      "delivery": "durable_projection",
      "requiredPayload": ["meta", "turns", "coverage"]
    },
    {
      "type": "timeline.index_page",
      "featureId": "ccpocket.conversation.sync",
      "featureMajor": 1,
      "featureMinor": 0,
      "direction": "server_to_client",
      "kind": "event",
      "targetScope": "thread",
      "delivery": "durable_projection",
      "requiredPayload": ["meta", "locators", "coverage"]
    },
    {
      "type": "timeline.latest_tail",
      "featureId": "ccpocket.conversation.sync",
      "featureMajor": 1,
      "featureMinor": 0,
      "direction": "server_to_client",
      "kind": "event",
      "targetScope": "thread",
      "delivery": "durable_projection",
      "requiredPayload": ["meta", "verifiedTail"]
    },
    {
      "type": "timeline.runtime_overlay",
      "featureId": "ccpocket.conversation.sync",
      "featureMajor": 1,
      "featureMinor": 0,
      "direction": "server_to_client",
      "kind": "event",
      "targetScope": "turn",
      "delivery": "memory_only",
      "requiredPayload": ["meta", "runtimeSessionId", "authorityGeneration", "overlay"]
    },
    {
      "type": "timeline.gap",
      "featureId": "ccpocket.conversation.sync",
      "featureMajor": 1,
      "featureMinor": 0,
      "direction": "server_to_client",
      "kind": "event",
      "targetScope": "thread",
      "delivery": "durable_projection",
      "requiredPayload": ["meta", "reason", "gap", "repairCursor", "retryClass"]
    },
    {
      "type": "sync.complete",
      "featureId": "ccpocket.conversation.sync",
      "featureMajor": 1,
      "featureMinor": 0,
      "direction": "server_to_client",
      "kind": "event",
      "targetScope": "sync_scope",
      "delivery": "durable_projection",
      "requiredPayload": ["meta", "windowComplete", "latestTurnComplete", "latestTurnGap", "checkpoint"]
    },
    {
      "type": "sync.resync_required",
      "featureId": "ccpocket.conversation.sync",
      "featureMajor": 1,
      "featureMinor": 0,